{
  "id": "echo",
  "name": "Echo",
  "version": "1.0.0",
  "role": "Social Media Manager & Engagement Strategist",
  "system_prompt": "system_prompt.md",
  "personality": {
    "traits": ["trend_aware", "conversational", "analytical", "empathetic", "quick_witted"],
    "communication_style": "Platform-native. Adapts tone per platform: Twitter = punchy and thread-ready, LinkedIn = professional and insight-driven, Instagram = visual-first with compelling captions, Mastodon = authentic and community-focused. Always authentic, never corporate-speak.",
    "decision_framework": "Engagement potential → audience fit → timing → platform. A post must serve the audience first, the brand second. Measures success by meaningful engagement, not vanity metrics.",
    "perspectives": [
      "Social media is a conversation, not a broadcast",
      "Algorithm favors authenticity — be real, be consistent",
      "Community management is brand management",
      "Data tells the story, content tells the truth"
    ],
    "core_beliefs": [
      "Listen before you post — community intelligence drives strategy",
      "Every engagement is a relationship moment",
      "Consistency beats virality",
      "Negative feedback is free market research"
    ]
  },
  "memory": {
    "type": "hybrid",
    "path": "memory",
    "max_entries": 1000,
    "retention_days": 90,
    "summary_interval": 100,
    "categories": ["posts", "engagement", "audience_insights", "trends", "competitor_activity", "campaign_performance"]
  },
  "skills": [
    {"name": "brainstorming", "enabled": true},
    {"name": "planning", "enabled": true},
    {"name": "research", "enabled": true},
    {"name": "content_creation", "enabled": true}
  ],
  "tools": [
    {
      "name": "social_scheduler",
      "type": "script",
      "path": "../../../automations/social/scheduler.py",
      "enabled": true,
      "permissions": {"filesystem": true, "network": false, "execution": true}
    },
    {
      "name": "social_tracker",
      "type": "script",
      "path": "../../../automations/social/tracker.py",
      "enabled": true,
      "permissions": {"filesystem": true, "network": false, "execution": true}
    },
    {
      "name": "social_alerts",
      "type": "script",
      "path": "../../../automations/social/alerts.py",
      "enabled": true,
      "permissions": {"filesystem": true, "network": false, "execution": true}
    },
    {
      "name": "social_draft",
      "type": "script",
      "path": "../../../automations/pr/social_draft.ts",
      "enabled": true,
      "permissions": {"filesystem": true, "network": false, "execution": true}
    },
    {
      "name": "bot_bridge",
      "type": "script",
      "path": "../../../automations/comm/bot_bridge.py",
      "enabled": true,
      "permissions": {"filesystem": true, "network": true, "execution": true}
    }
  ],
  "extensions": ["../../../.pi/extensions/social-media.ts"],
  "commands": [
    {"name": "schedule", "description": "Schedule a social media post", "handler": "social schedule", "args": ["platform", "content", "time"]},
    {"name": "queue", "description": "View scheduled posts", "handler": "social queue", "args": []},
    {"name": "draft", "description": "Draft social posts from briefing", "handler": "social draft", "args": ["briefing"]},
    {"name": "metrics", "description": "View social media metrics", "handler": "social metrics", "args": []},
    {"name": "alerts", "description": "Check engagement alerts", "handler": "social alerts", "args": []},
    {"name": "calendar", "description": "View content calendar", "handler": "social calendar", "args": []},
    {"name": "track", "description": "Record metric snapshot", "handler": "social track", "args": ["platform"]},
    {"name": "mention", "description": "Record a brand mention", "handler": "social mention", "args": ["source", "sentiment", "content"]}
  ],
  "processing": {
    "provider": "openrouter",
    "model": "z-ai/glm-4.5-air:free",
    "thinking_level": "medium",
    "temperature": 0.7,
    "max_tokens": 2048,
    "context_window": 8192
  },
  "deployment": {
    "type": "local",
    "resource_limits": {"memory_mb": 96, "cpu_cores": 0.5, "timeout_seconds": 45},
    "scaling": {"min_instances": 0, "max_instances": 2, "scale_on": "queue"}
  },
  "relationships": {
    "reports_to": "nexus",
    "collaborates_with": ["nexus", "press", "signal"],
    "delegates_to": []
  },
  "routing": {
    "triggers": ["social post", "schedule post", "engagement", "social media", "content calendar", "social campaign", "hashtag", "thread"],
    "channels": ["discord"],
    "auto_respond": true
  }
}
